Question ID,Question Title,Difficulty Level,Similar Questions Text,Solution Link,url,Question Text,Python Solution Path,Solution Exists
148,Sort List,Medium,"[Merge Two Sorted Lists, /problems/merge-two-sorted-lists/, Easy], [Sort Colors, /problems/sort-colors/, Medium], [Insertion Sort List, /problems/insertion-sort-list/, Medium]",https://leetcode.com/articles/sort-list,https://leetcode.com/problems/sort-list,"Given the head of a linked list, return the list after sorting it in ascending order. ",./PythonSolutions/sort-list.py,True
149,Max Points on a Line,Hard,"[Line Reflection, /problems/line-reflection/, Medium]",https://leetcode.com/articles/max-points-on-a-line,https://leetcode.com/problems/max-points-on-a-line,"Given an array of points where points[i] = [xi, yi] represents a point on the X-Y plane, return the maximum number of points that lie on the same straight line. ",./PythonSolutions/max-points-on-a-line.py,True
150,Evaluate Reverse Polish Notation,Medium,"[Basic Calculator, /problems/basic-calculator/, Hard], [Expression Add Operators, /problems/expression-add-operators/, Hard]",https://leetcode.com/articles/evaluate-reverse-polish-notation,https://leetcode.com/problems/evaluate-reverse-polish-notation,"Evaluate the value of an arithmetic expression in Reverse Polish Notation. Valid operators are +, -, *, and /. Each operand may be an integer or another expression. Note that division between two integers should truncate toward zero. It is guaranteed that the given RPN expression is always valid. That means the expression would always evaluate to a result, and there will not be any division by zero operation. ",./PythonSolutions/evaluate-reverse-polish-notation.py,True
151,Reverse Words in a String,Medium,"[Reverse Words in a String II, /problems/reverse-words-in-a-string-ii/, Medium]",https://leetcode.com/articles/reverse-words-in-a-string,https://leetcode.com/problems/reverse-words-in-a-string,"Given an input string s, reverse the order of the words. A word is defined as a sequence of non-space characters. The words in s will be separated by at least one space. Return a string of the words in reverse order concatenated by a single space. Note that s may contain leading or trailing spaces or multiple spaces between two words. The returned string should only have a single space separating the words. Do not include any extra spaces. ",./PythonSolutions/reverse-words-in-a-string.py,True
152,Maximum Product Subarray,Medium,"[Maximum Subarray, /problems/maximum-subarray/, Easy], [House Robber, /problems/house-robber/, Medium], [Product of Array Except Self, /problems/product-of-array-except-self/, Medium], [Maximum Product of Three Numbers, /problems/maximum-product-of-three-numbers/, Easy], [Subarray Product Less Than K, /problems/subarray-product-less-than-k/, Medium]",https://leetcode.com/articles/maximum-product-subarray,https://leetcode.com/problems/maximum-product-subarray,"Given an integer array nums, find a contiguous non-empty subarray within the array that has the largest product, and return the product. The test cases are generated so that the answer will fit in a 32-bit integer. A subarray is a contiguous subsequence of the array. ",./PythonSolutions/maximum-product-subarray.py,True
153,Find Minimum in Rotated Sorted Array,Medium,"[Search in Rotated Sorted Array, /problems/search-in-rotated-sorted-array/, Medium], [Find Minimum in Rotated Sorted Array II, /problems/find-minimum-in-rotated-sorted-array-ii/, Hard]",https://leetcode.com/articles/find-minimum-in-rotated-sorted-array,https://leetcode.com/problems/find-minimum-in-rotated-sorted-array,"Suppose an array of length n sorted in ascending order is rotated between 1 and n times. For example, the array nums = [0,1,2,4,5,6,7] might become: Notice that rotating an array [a[0], a[1], a[2], ..., a[n-1]] 1 time results in the array [a[n-1], a[0], a[1], a[2], ..., a[n-2]]. Given the sorted rotated array nums of unique elements, return the minimum element of this array. You must write an algorithm that runs in O(log n) time. ",./PythonSolutions/find-minimum-in-rotated-sorted-array.py,True
154,Find Minimum in Rotated Sorted Array II,Hard,"[Find Minimum in Rotated Sorted Array, /problems/find-minimum-in-rotated-sorted-array/, Medium]",https://leetcode.com/articles/find-minimum-in-rotated-sorted-array-ii,https://leetcode.com/problems/find-minimum-in-rotated-sorted-array-ii,"Suppose an array of length n sorted in ascending order is rotated between 1 and n times. For example, the array nums = [0,1,4,4,5,6,7] might become: Notice that rotating an array [a[0], a[1], a[2], ..., a[n-1]] 1 time results in the array [a[n-1], a[0], a[1], a[2], ..., a[n-2]]. Given the sorted rotated array nums that may contain duplicates, return the minimum element of this array. You must decrease the overall operation steps as much as possible. ",./PythonSolutions/find-minimum-in-rotated-sorted-array-ii.py,True
155,Min Stack,Easy,"[Sliding Window Maximum, /problems/sliding-window-maximum/, Hard], [Max Stack, /problems/max-stack/, Easy]",https://leetcode.com/articles/min-stack,https://leetcode.com/problems/min-stack,"Design a stack that supports push, pop, top, and retrieving the minimum element in constant time. Implement the MinStack class: ",./PythonSolutions/min-stack.py,True
160,Intersection of Two Linked Lists,Easy,"[Minimum Index Sum of Two Lists, /problems/minimum-index-sum-of-two-lists/, Easy]",https://leetcode.com/articles/intersection-of-two-linked-lists,https://leetcode.com/problems/intersection-of-two-linked-lists,"Given the heads of two singly linked-lists headA and headB, return the node at which the two lists intersect. If the two linked lists have no intersection at all, return null. For example, the following two linked lists begin to intersect at node c1: The test cases are generated such that there are no cycles anywhere in the entire linked structure. Note that the linked lists must retain their original structure after the function returns. Custom Judge: The inputs to the judge are given as follows (your program is not given these inputs): The judge will then create the linked structure based on these inputs and pass the two heads, headA and headB to your program. If you correctly return the intersected node, then your solution will be accepted. ",./PythonSolutions/intersection-of-two-linked-lists.py,True
162,Find Peak Element,Medium,"[Peak Index in a Mountain Array, /problems/peak-index-in-a-mountain-array/, Easy]",https://leetcode.com/articles/find-peak-element,https://leetcode.com/problems/find-peak-element,"A peak element is an element that is strictly greater than its neighbors. Given an integer array nums, find a peak element, and return its index. If the array contains multiple peaks, return the index to any of the peaks. You may imagine that nums[-1] = nums[n] = -∞. You must write an algorithm that runs in O(log n) time. ",./PythonSolutions/find-peak-element.py,True
169,Majority Element,Easy,"[Majority Element II, /problems/majority-element-ii/, Medium], [Check If a Number Is Majority Element in a Sorted Array, /problems/check-if-a-number-is-majority-element-in-a-sorted-array/, Easy]",https://leetcode.com/articles/majority-element,https://leetcode.com/problems/majority-element,"Given an array nums of size n, return the majority element. The majority element is the element that appears more than ⌊n / 2⌋ times. You may assume that the majority element always exists in the array. ",./PythonSolutions/majority-element.py,True
171,Excel Sheet Column Number,Easy,"[Excel Sheet Column Title, /problems/excel-sheet-column-title/, Easy]",https://leetcode.com/articles/excel-sheet-column-number,https://leetcode.com/problems/excel-sheet-column-number,"Given a string columnTitle that represents the column title as appear in an Excel sheet, return its corresponding column number. For example: ",./PythonSolutions/excel-sheet-column-number.py,True
172,Factorial Trailing Zeroes,Easy,"[Number of Digit One, /problems/number-of-digit-one/, Hard], [Preimage Size of Factorial Zeroes Function, /problems/preimage-size-of-factorial-zeroes-function/, Hard]",https://leetcode.com/articles/factorial-trailing-zeroes,https://leetcode.com/problems/factorial-trailing-zeroes,"Given an integer n, return the number of trailing zeroes in n!. Note that n! = n * (n - 1) * (n - 2) * ... * 3 * 2 * 1. ",./PythonSolutions/factorial-trailing-zeroes.py,True
173,Binary Search Tree Iterator,Medium,"[Binary Tree Inorder Traversal, /problems/binary-tree-inorder-traversal/, Medium], [Flatten 2D Vector, /problems/flatten-2d-vector/, Medium], [Zigzag Iterator, /problems/zigzag-iterator/, Medium], [Peeking Iterator, /problems/peeking-iterator/, Medium], [Inorder Successor in BST, /problems/inorder-successor-in-bst/, Medium], [Binary Search Tree Iterator II, /problems/binary-search-tree-iterator-ii/, Medium]",https://leetcode.com/articles/binary-search-tree-iterator,https://leetcode.com/problems/binary-search-tree-iterator,"Implement the BSTIterator class that represents an iterator over the in-order traversal of a binary search tree (BST): Notice that by initializing the pointer to a non-existent smallest number, the first call to next() will return the smallest element in the BST. You may assume that next() calls will always be valid. That is, there will be at least a next number in the in-order traversal when next() is called. ",./PythonSolutions/binary-search-tree-iterator.py,True
174,Dungeon Game,Hard,"[Unique Paths, /problems/unique-paths/, Medium], [Minimum Path Sum, /problems/minimum-path-sum/, Medium], [Cherry Pickup, /problems/cherry-pickup/, Hard]",https://leetcode.com/articles/dungeon-game,https://leetcode.com/problems/dungeon-game,"The demons had captured the princess and imprisoned her in the bottom-right corner of a dungeon. The dungeon consists of m x n rooms laid out in a 2D grid. Our valiant knight was initially positioned in the top-left room and must fight his way through dungeon to rescue the princess. The knight has an initial health point represented by a positive integer. If at any point his health point drops to 0 or below, he dies immediately. Some of the rooms are guarded by demons (represented by negative integers), so the knight loses health upon entering these rooms; other rooms are either empty (represented as 0) or contain magic orbs that increase the knight's health (represented by positive integers). To reach the princess as quickly as possible, the knight decides to move only rightward or downward in each step. Return the knight's minimum initial health so that he can rescue the princess. Note that any room can contain threats or power-ups, even the first room the knight enters and the bottom-right room where the princess is imprisoned. ",./PythonSolutions/dungeon-game.py,True
188,Best Time to Buy and Sell Stock IV,Hard,"[Best Time to Buy and Sell Stock, /problems/best-time-to-buy-and-sell-stock/, Easy], [Best Time to Buy and Sell Stock II, /problems/best-time-to-buy-and-sell-stock-ii/, Easy], [Best Time to Buy and Sell Stock III, /problems/best-time-to-buy-and-sell-stock-iii/, Hard]",https://leetcode.com/articles/best-time-to-buy-and-sell-stock-iv,https://leetcode.com/problems/best-time-to-buy-and-sell-stock-iv,"You are given an integer array prices where prices[i] is the price of a given stock on the ith day, and an integer k. Find the maximum profit you can achieve. You may complete at most k transactions. Note: You may not engage in multiple transactions simultaneously (i.e., you must sell the stock before you buy again). ",./PythonSolutions/best-time-to-buy-and-sell-stock-iv.py,True
189,Rotate Array,Medium,"[Rotate List, /problems/rotate-list/, Medium], [Reverse Words in a String II, /problems/reverse-words-in-a-string-ii/, Medium]",https://leetcode.com/articles/rotate-array,https://leetcode.com/problems/rotate-array,"Given an array, rotate the array to the right by k steps, where k is non-negative. ",./PythonSolutions/rotate-array.py,True
190,Reverse Bits,Easy,"[Reverse Integer, /problems/reverse-integer/, Easy], [Number of 1 Bits, /problems/number-of-1-bits/, Easy]",https://leetcode.com/articles/reverse-bits,https://leetcode.com/problems/reverse-bits,Reverse bits of a given 32 bits unsigned integer. Note: ,./PythonSolutions/reverse-bits.py,True
191,Number of 1 Bits,Easy,"[Reverse Bits, /problems/reverse-bits/, Easy], [Power of Two, /problems/power-of-two/, Easy], [Counting Bits, /problems/counting-bits/, Medium], [Binary Watch, /problems/binary-watch/, Easy], [Hamming Distance, /problems/hamming-distance/, Easy], [Binary Number with Alternating Bits, /problems/binary-number-with-alternating-bits/, Easy], [Prime Number of Set Bits in Binary Representation, /problems/prime-number-of-set-bits-in-binary-representation/, Easy]",https://leetcode.com/articles/number-1-bits,https://leetcode.com/problems/number-of-1-bits,Write a function that takes an unsigned integer and returns the number of '1' bits it has (also known as the Hamming weight). Note: ,./PythonSolutions/number-of-1-bits.py,True
198,House Robber,Medium,"[Maximum Product Subarray, /problems/maximum-product-subarray/, Medium], [House Robber II, /problems/house-robber-ii/, Medium], [Paint House, /problems/paint-house/, Medium], [Paint Fence, /problems/paint-fence/, Medium], [House Robber III, /problems/house-robber-iii/, Medium], [Non-negative Integers without Consecutive Ones, /problems/non-negative-integers-without-consecutive-ones/, Hard], [Coin Path, /problems/coin-path/, Hard], [Delete and Earn, /problems/delete-and-earn/, Medium]",https://leetcode.com/articles/house-robber,https://leetcode.com/problems/house-robber,"You are a professional robber planning to rob houses along a street. Each house has a certain amount of money stashed, the only constraint stopping you from robbing each of them is that adjacent houses have security systems connected and it will automatically contact the police if two adjacent houses were broken into on the same night. Given an integer array nums representing the amount of money of each house, return the maximum amount of money you can rob tonight without alerting the police. ",./PythonSolutions/house-robber.py,True
199,Binary Tree Right Side View,Medium,"[Populating Next Right Pointers in Each Node, /problems/populating-next-right-pointers-in-each-node/, Medium], [Boundary of Binary Tree, /problems/boundary-of-binary-tree/, Medium]",https://leetcode.com/articles/binary-tree-right-side-view,https://leetcode.com/problems/binary-tree-right-side-view,"Given the root of a binary tree, imagine yourself standing on the right side of it, return the values of the nodes you can see ordered from top to bottom. ",./PythonSolutions/binary-tree-right-side-view.py,True
200,Number of Islands,Medium,"[Surrounded Regions, /problems/surrounded-regions/, Medium], [Walls and Gates, /problems/walls-and-gates/, Medium], [Number of Islands II, /problems/number-of-islands-ii/, Hard], [Number of Connected Components in an Undirected Graph, /problems/number-of-connected-components-in-an-undirected-graph/, Medium], [Number of Distinct Islands, /problems/number-of-distinct-islands/, Medium], [Max Area of Island, /problems/max-area-of-island/, Medium]",https://leetcode.com/articles/number-of-islands,https://leetcode.com/problems/number-of-islands,"Given an m x n 2D binary grid grid which represents a map of '1's (land) and '0's (water), return the number of islands. An island is surrounded by water and is formed by connecting adjacent lands horizontally or vertically. You may assume all four edges of the grid are all surrounded by water. ",./PythonSolutions/number-of-islands.py,True
202,Happy Number,Easy,"[Linked List Cycle, /problems/linked-list-cycle/, Easy], [Add Digits, /problems/add-digits/, Easy], [Ugly Number, /problems/ugly-number/, Easy]",https://leetcode.com/articles/happy-number,https://leetcode.com/problems/happy-number,"Write an algorithm to determine if a number n is happy. A happy number is a number defined by the following process: Return true if n is a happy number, and false if not. ",./PythonSolutions/happy-number.py,True
203,Remove Linked List Elements,Easy,"[Remove Element, /problems/remove-element/, Easy], [Delete Node in a Linked List, /problems/delete-node-in-a-linked-list/, Easy]",https://leetcode.com/articles/remove-linked-list-elements,https://leetcode.com/problems/remove-linked-list-elements,"Given the head of a linked list and an integer val, remove all the nodes of the linked list that has Node.val == val, and return the new head. ",./PythonSolutions/remove-linked-list-elements.py,True
206,Reverse Linked List,Easy,"[Reverse Linked List II, /problems/reverse-linked-list-ii/, Medium], [Binary Tree Upside Down, /problems/binary-tree-upside-down/, Medium], [Palindrome Linked List, /problems/palindrome-linked-list/, Easy]",https://leetcode.com/articles/reverse-linked-list,https://leetcode.com/problems/reverse-linked-list,"Given the head of a singly linked list, reverse the list, and return the reversed list. ",./PythonSolutions/reverse-linked-list.py,True
207,Course Schedule,Medium,"[Course Schedule II, /problems/course-schedule-ii/, Medium], [Graph Valid Tree, /problems/graph-valid-tree/, Medium], [Minimum Height Trees, /problems/minimum-height-trees/, Medium], [Course Schedule III, /problems/course-schedule-iii/, Hard]",https://leetcode.com/articles/course-schedule,https://leetcode.com/problems/course-schedule,"There are a total of numCourses courses you have to take, labeled from 0 to numCourses - 1. You are given an array prerequisites where prerequisites[i] = [ai, bi] indicates that you must take course bi first if you want to take course ai. Return true if you can finish all courses. Otherwise, return false. ",./PythonSolutions/course-schedule.py,True
208,Implement Trie (Prefix Tree),Medium,"[Design Add and Search Words Data Structure, /problems/design-add-and-search-words-data-structure/, Medium], [Design Search Autocomplete System, /problems/design-search-autocomplete-system/, Hard], [Replace Words, /problems/replace-words/, Medium], [Implement Magic Dictionary, /problems/implement-magic-dictionary/, Medium], [Implement Trie II (Prefix Tree), /problems/implement-trie-ii-prefix-tree/, Medium]",https://leetcode.com/articles/implement-trie-prefix-tree,https://leetcode.com/problems/implement-trie-prefix-tree,"A trie (pronounced as ""try"") or prefix tree is a tree data structure used to efficiently store and retrieve keys in a dataset of strings. There are various applications of this data structure, such as autocomplete and spellchecker. Implement the Trie class: ",./PythonSolutions/implement-trie-prefix-tree.py,True
209,Minimum Size Subarray Sum,Medium,"[Minimum Window Substring, /problems/minimum-window-substring/, Hard], [Maximum Size Subarray Sum Equals k, /problems/maximum-size-subarray-sum-equals-k/, Medium], [Maximum Length of Repeated Subarray, /problems/maximum-length-of-repeated-subarray/, Medium], [Minimum Operations to Reduce X to Zero, /problems/minimum-operations-to-reduce-x-to-zero/, Medium]",https://leetcode.com/articles/minimum-size-subarray-sum,https://leetcode.com/problems/minimum-size-subarray-sum,"Given an array of positive integers nums and a positive integer target, return the minimal length of a contiguous subarray [numsl, numsl+1, ..., numsr-1, numsr] of which the sum is greater than or equal to target. If there is no such subarray, return 0 instead. ",./PythonSolutions/minimum-size-subarray-sum.py,True
210,Course Schedule II,Medium,"[Course Schedule, /problems/course-schedule/, Medium], [Alien Dictionary, /problems/alien-dictionary/, Hard], [Minimum Height Trees, /problems/minimum-height-trees/, Medium], [Sequence Reconstruction, /problems/sequence-reconstruction/, Medium], [Course Schedule III, /problems/course-schedule-iii/, Hard], [Parallel Courses, /problems/parallel-courses/, Medium]",https://leetcode.com/articles/course-schedule-ii,https://leetcode.com/problems/course-schedule-ii,"There are a total of numCourses courses you have to take, labeled from 0 to numCourses - 1. You are given an array prerequisites where prerequisites[i] = [ai, bi] indicates that you must take course bi first if you want to take course ai. Return the ordering of courses you should take to finish all courses. If there are many valid answers, return any of them. If it is impossible to finish all courses, return an empty array. ",./PythonSolutions/course-schedule-ii.py,True
212,Word Search II,Hard,"[Word Search, /problems/word-search/, Medium], [Unique Paths III, /problems/unique-paths-iii/, Hard]",https://leetcode.com/articles/word-search-ii,https://leetcode.com/problems/word-search-ii,"Given an m x n board of characters and a list of strings words, return all words on the board. Each word must be constructed from letters of sequentially adjacent cells, where adjacent cells are horizontally or vertically neighboring. The same letter cell may not be used more than once in a word. ",./PythonSolutions/word-search-ii.py,True
213,House Robber II,Medium,"[House Robber, /problems/house-robber/, Medium], [Paint House, /problems/paint-house/, Medium], [Paint Fence, /problems/paint-fence/, Medium], [House Robber III, /problems/house-robber-iii/, Medium], [Non-negative Integers without Consecutive Ones, /problems/non-negative-integers-without-consecutive-ones/, Hard], [Coin Path, /problems/coin-path/, Hard]",https://leetcode.com/articles/house-robber-ii,https://leetcode.com/problems/house-robber-ii,"You are a professional robber planning to rob houses along a street. Each house has a certain amount of money stashed. All houses at this place are arranged in a circle. That means the first house is the neighbor of the last one. Meanwhile, adjacent houses have a security system connected, and it will automatically contact the police if two adjacent houses were broken into on the same night. Given an integer array nums representing the amount of money of each house, return the maximum amount of money you can rob tonight without alerting the police. ",./PythonSolutions/house-robber-ii.py,True
214,Shortest Palindrome,Hard,"[Longest Palindromic Substring, /problems/longest-palindromic-substring/, Medium], [Implement strStr(), /problems/implement-strstr/, Easy], [Palindrome Pairs, /problems/palindrome-pairs/, Hard]",https://leetcode.com/articles/shortest-palindrome,https://leetcode.com/problems/shortest-palindrome,You are given a string s. You can convert s to a palindrome by adding characters in front of it. Return the shortest palindrome you can find by performing this transformation. ,./PythonSolutions/shortest-palindrome.py,True
215,Kth Largest Element in an Array,Medium,"[Wiggle Sort II, /problems/wiggle-sort-ii/, Medium], [Top K Frequent Elements, /problems/top-k-frequent-elements/, Medium], [Third Maximum Number, /problems/third-maximum-number/, Easy], [Kth Largest Element in a Stream, /problems/kth-largest-element-in-a-stream/, Easy], [K Closest Points to Origin, /problems/k-closest-points-to-origin/, Medium]",https://leetcode.com/articles/kth-largest-element-in-an-array,https://leetcode.com/problems/kth-largest-element-in-an-array,"Given an integer array nums and an integer k, return the kth largest element in the array. Note that it is the kth largest element in the sorted order, not the kth distinct element. ",./PythonSolutions/kth-largest-element-in-an-array.py,True
216,Combination Sum III,Medium,"[Combination Sum, /problems/combination-sum/, Medium]",https://leetcode.com/articles/combination-sum-iii,https://leetcode.com/problems/combination-sum-iii,"Find all valid combinations of k numbers that sum up to n such that the following conditions are true: Return a list of all possible valid combinations. The list must not contain the same combination twice, and the combinations may be returned in any order. ",./PythonSolutions/combination-sum-iii.py,True
217,Contains Duplicate,Easy,"[Contains Duplicate II, /problems/contains-duplicate-ii/, Easy], [Contains Duplicate III, /problems/contains-duplicate-iii/, Medium]",https://leetcode.com/articles/contains-duplicate,https://leetcode.com/problems/contains-duplicate,"Given an integer array nums, return true if any value appears at least twice in the array, and return false if every element is distinct. ",./PythonSolutions/contains-duplicate.py,True
218,The Skyline Problem,Hard,"[Falling Squares, /problems/falling-squares/, Hard]",https://leetcode.com/articles/skyline-problem,https://leetcode.com/problems/the-skyline-problem,"A city's skyline is the outer contour of the silhouette formed by all the buildings in that city when viewed from a distance. Given the locations and heights of all the buildings, return the skyline formed by these buildings collectively. The geometric information of each building is given in the array buildings where buildings[i] = [lefti, righti, heighti]: You may assume all buildings are perfect rectangles grounded on an absolutely flat surface at height 0. The skyline should be represented as a list of ""key points"" sorted by their x-coordinate in the form [[x1,y1],[x2,y2],...]. Each key point is the left endpoint of some horizontal segment in the skyline except the last point in the list, which always has a y-coordinate 0 and is used to mark the skyline's termination where the rightmost building ends. Any ground between the leftmost and rightmost buildings should be part of the skyline's contour. Note: There must be no consecutive horizontal lines of equal height in the output skyline. For instance, [...,[2 3],[4 5],[7 5],[11 5],[12 7],...] is not acceptable; the three lines of height 5 should be merged into one in the final output as such: [...,[2 3],[4 5],[12 7],...] ",./PythonSolutions/the-skyline-problem.py,True
