Question ID,Question Title,Difficulty Level,Similar Questions Text,Solution Link,url,Question Text,Python Solution Path,Solution Exists
103,Binary Tree Zigzag Level Order Traversal,Medium,"[Binary Tree Level Order Traversal, /problems/binary-tree-level-order-traversal/, Medium]",https://leetcode.com/articles/binary-tree-zigzag-level-order-traversal,https://leetcode.com/problems/binary-tree-zigzag-level-order-traversal,"Given the root of a binary tree, return the zigzag level order traversal of its nodes' values. (i.e., from left to right, then right to left for the next level and alternate between). ",./PythonSolutions/binary-tree-zigzag-level-order-traversal.py,True
104,Maximum Depth of Binary Tree,Easy,"[Balanced Binary Tree, /problems/balanced-binary-tree/, Easy], [Minimum Depth of Binary Tree, /problems/minimum-depth-of-binary-tree/, Easy], [Maximum Depth of N-ary Tree, /problems/maximum-depth-of-n-ary-tree/, Easy], [Time Needed to Inform All Employees, /problems/time-needed-to-inform-all-employees/, Medium]",https://leetcode.com/articles/maximum-depth-of-binary-tree,https://leetcode.com/problems/maximum-depth-of-binary-tree,"Given the root of a binary tree, return its maximum depth. A binary tree's maximum depth is the number of nodes along the longest path from the root node down to the farthest leaf node. ",./PythonSolutions/maximum-depth-of-binary-tree.py,True
105,Construct Binary Tree from Preorder and Inorder Traversal,Medium,"[Construct Binary Tree from Inorder and Postorder Traversal, /problems/construct-binary-tree-from-inorder-and-postorder-traversal/, Medium]",https://leetcode.com/articles/construct-binary-tree-from-preorder-and-inorder-traversal,https://leetcode.com/problems/construct-binary-tree-from-preorder-and-inorder-traversal,"Given two integer arrays preorder and inorder where preorder is the preorder traversal of a binary tree and inorder is the inorder traversal of the same tree, construct and return the binary tree. ",./PythonSolutions/construct-binary-tree-from-preorder-and-inorder-traversal.py,True
106,Construct Binary Tree from Inorder and Postorder Traversal,Medium,"[Construct Binary Tree from Preorder and Inorder Traversal, /problems/construct-binary-tree-from-preorder-and-inorder-traversal/, Medium]",https://leetcode.com/articles/construct-binary-tree-from-inorder-and-postorder-traversal,https://leetcode.com/problems/construct-binary-tree-from-inorder-and-postorder-traversal,"Given two integer arrays inorder and postorder where inorder is the inorder traversal of a binary tree and postorder is the postorder traversal of the same tree, construct and return the binary tree. ",./PythonSolutions/construct-binary-tree-from-inorder-and-postorder-traversal.py,True
107,Binary Tree Level Order Traversal II,Medium,"[Binary Tree Level Order Traversal, /problems/binary-tree-level-order-traversal/, Medium], [Average of Levels in Binary Tree, /problems/average-of-levels-in-binary-tree/, Easy]",https://leetcode.com/articles/binary-tree-level-order-traversal-ii,https://leetcode.com/problems/binary-tree-level-order-traversal-ii,"Given the root of a binary tree, return the bottom-up level order traversal of its nodes' values. (i.e., from left to right, level by level from leaf to root). ",./PythonSolutions/binary-tree-level-order-traversal-ii.py,True
108,Convert Sorted Array to Binary Search Tree,Easy,"[Convert Sorted List to Binary Search Tree, /problems/convert-sorted-list-to-binary-search-tree/, Medium]",https://leetcode.com/articles/convert-sorted-array-to-bst,https://leetcode.com/problems/convert-sorted-array-to-binary-search-tree,"Given an integer array nums where the elements are sorted in ascending order, convert it to a height-balanced binary search tree. A height-balanced binary tree is a binary tree in which the depth of the two subtrees of every node never differs by more than one. ",./PythonSolutions/convert-sorted-array-to-binary-search-tree.py,True
109,Convert Sorted List to Binary Search Tree,Medium,"[Convert Sorted Array to Binary Search Tree, /problems/convert-sorted-array-to-binary-search-tree/, Easy]",https://leetcode.com/articles/convert-sorted-list-to-binary-search-tree,https://leetcode.com/problems/convert-sorted-list-to-binary-search-tree,"Given the head of a singly linked list where elements are sorted in ascending order, convert it to a height balanced BST. For this problem, a height-balanced binary tree is defined as a binary tree in which the depth of the two subtrees of every node never differ by more than 1. ",./PythonSolutions/convert-sorted-list-to-binary-search-tree.py,True
110,Balanced Binary Tree,Easy,"[Maximum Depth of Binary Tree, /problems/maximum-depth-of-binary-tree/, Easy]",https://leetcode.com/articles/balanced-binary-tree,https://leetcode.com/problems/balanced-binary-tree,"Given a binary tree, determine if it is height-balanced. For this problem, a height-balanced binary tree is defined as: a binary tree in which the left and right subtrees of every node differ in height by no more than 1. ",./PythonSolutions/balanced-binary-tree.py,True
111,Minimum Depth of Binary Tree,Easy,"[Binary Tree Level Order Traversal, /problems/binary-tree-level-order-traversal/, Medium], [Maximum Depth of Binary Tree, /problems/maximum-depth-of-binary-tree/, Easy]",https://leetcode.com/articles/minimum-depth-of-binary-tree,https://leetcode.com/problems/minimum-depth-of-binary-tree,"Given a binary tree, find its minimum depth. The minimum depth is the number of nodes along the shortest path from the root node down to the nearest leaf node. Note: A leaf is a node with no children. ",./PythonSolutions/minimum-depth-of-binary-tree.py,True
112,Path Sum,Easy,"[Path Sum II, /problems/path-sum-ii/, Medium], [Binary Tree Maximum Path Sum, /problems/binary-tree-maximum-path-sum/, Hard], [Sum Root to Leaf Numbers, /problems/sum-root-to-leaf-numbers/, Medium], [Path Sum III, /problems/path-sum-iii/, Medium], [Path Sum IV, /problems/path-sum-iv/, Medium]",https://leetcode.com/articles/path-sum,https://leetcode.com/problems/path-sum,"Given the root of a binary tree and an integer targetSum, return true if the tree has a root-to-leaf path such that adding up all the values along the path equals targetSum. A leaf is a node with no children. ",./PythonSolutions/path-sum.py,True
113,Path Sum II,Medium,"[Path Sum, /problems/path-sum/, Easy], [Binary Tree Paths, /problems/binary-tree-paths/, Easy], [Path Sum III, /problems/path-sum-iii/, Medium], [Path Sum IV, /problems/path-sum-iv/, Medium]",https://leetcode.com/articles/path-sum-ii,https://leetcode.com/problems/path-sum-ii,"Given the root of a binary tree and an integer targetSum, return all root-to-leaf paths where the sum of the node values in the path equals targetSum. Each path should be returned as a list of the node values, not node references. A root-to-leaf path is a path starting from the root and ending at any leaf node. A leaf is a node with no children. ",./PythonSolutions/path-sum-ii.py,True
114,Flatten Binary Tree to Linked List,Medium,"[Flatten a Multilevel Doubly Linked List, /problems/flatten-a-multilevel-doubly-linked-list/, Medium], [Correct a Binary Tree, /problems/correct-a-binary-tree/, Medium]",https://leetcode.com/articles/flatten-binary-tree-to-linked-list,https://leetcode.com/problems/flatten-binary-tree-to-linked-list,"Given the root of a binary tree, flatten the tree into a ""linked list"": ",./PythonSolutions/flatten-binary-tree-to-linked-list.py,True
116,Populating Next Right Pointers in Each Node,Medium,"[Populating Next Right Pointers in Each Node II, /problems/populating-next-right-pointers-in-each-node-ii/, Medium], [Binary Tree Right Side View, /problems/binary-tree-right-side-view/, Medium]",https://leetcode.com/articles/populating-next-right-pointers-in-each-node,https://leetcode.com/problems/populating-next-right-pointers-in-each-node,"You are given a perfect binary tree where all leaves are on the same level, and every parent has two children. The binary tree has the following definition: Populate each next pointer to point to its next right node. If there is no next right node, the next pointer should be set to NULL. Initially, all next pointers are set to NULL. ",./PythonSolutions/populating-next-right-pointers-in-each-node.py,True
117,Populating Next Right Pointers in Each Node II,Medium,"[Populating Next Right Pointers in Each Node, /problems/populating-next-right-pointers-in-each-node/, Medium]",https://leetcode.com/articles/populating-next-right-pointers-in-each-node-ii,https://leetcode.com/problems/populating-next-right-pointers-in-each-node-ii,"Given a binary tree Populate each next pointer to point to its next right node. If there is no next right node, the next pointer should be set to NULL. Initially, all next pointers are set to NULL. ",./PythonSolutions/populating-next-right-pointers-in-each-node-ii.py,True
118,Pascal's Triangle,Easy,"[Pascal's Triangle II, /problems/pascals-triangle-ii/, Easy]",https://leetcode.com/articles/pascals-triangle,https://leetcode.com/problems/pascals-triangle,"Given an integer numRows, return the first numRows of Pascal's triangle. In Pascal's triangle, each number is the sum of the two numbers directly above it as shown: ",./PythonSolutions/pascals-triangle.py,True
119,Pascal's Triangle II,Easy,"[Pascal's Triangle, /problems/pascals-triangle/, Easy]",https://leetcode.com/articles/pascals-triangle-ii,https://leetcode.com/problems/pascals-triangle-ii,"Given an integer rowIndex, return the rowIndexth (0-indexed) row of the Pascal's triangle. In Pascal's triangle, each number is the sum of the two numbers directly above it as shown: ",./PythonSolutions/pascals-triangle-ii.py,True
121,Best Time to Buy and Sell Stock,Easy,"[Maximum Subarray, /problems/maximum-subarray/, Easy], [Best Time to Buy and Sell Stock II, /problems/best-time-to-buy-and-sell-stock-ii/, Easy], [Best Time to Buy and Sell Stock III, /problems/best-time-to-buy-and-sell-stock-iii/, Hard], [Best Time to Buy and Sell Stock IV, /problems/best-time-to-buy-and-sell-stock-iv/, Hard], [Best Time to Buy and Sell Stock with Cooldown, /problems/best-time-to-buy-and-sell-stock-with-cooldown/, Medium]",https://leetcode.com/articles/best-time-to-buy-and-sell-stock,https://leetcode.com/problems/best-time-to-buy-and-sell-stock,"You are given an array prices where prices[i] is the price of a given stock on the ith day. You want to maximize your profit by choosing a single day to buy one stock and choosing a different day in the future to sell that stock. Return the maximum profit you can achieve from this transaction. If you cannot achieve any profit, return 0. ",./PythonSolutions/best-time-to-buy-and-sell-stock.py,True
122,Best Time to Buy and Sell Stock II,Easy,"[Best Time to Buy and Sell Stock, /problems/best-time-to-buy-and-sell-stock/, Easy], [Best Time to Buy and Sell Stock III, /problems/best-time-to-buy-and-sell-stock-iii/, Hard], [Best Time to Buy and Sell Stock IV, /problems/best-time-to-buy-and-sell-stock-iv/, Hard], [Best Time to Buy and Sell Stock with Cooldown, /problems/best-time-to-buy-and-sell-stock-with-cooldown/, Medium], [Best Time to Buy and Sell Stock with Transaction Fee, /problems/best-time-to-buy-and-sell-stock-with-transaction-fee/, Medium]",https://leetcode.com/articles/best-time-to-buy-and-sell-stock-ii,https://leetcode.com/problems/best-time-to-buy-and-sell-stock-ii,"You are given an integer array prices where prices[i] is the price of a given stock on the ith day. On each day, you may decide to buy and/or sell the stock. You can only hold at most one share of the stock at any time. However, you can buy it then immediately sell it on the same day. Find and return the maximum profit you can achieve. ",./PythonSolutions/best-time-to-buy-and-sell-stock-ii.py,True
123,Best Time to Buy and Sell Stock III,Hard,"[Best Time to Buy and Sell Stock, /problems/best-time-to-buy-and-sell-stock/, Easy], [Best Time to Buy and Sell Stock II, /problems/best-time-to-buy-and-sell-stock-ii/, Easy], [Best Time to Buy and Sell Stock IV, /problems/best-time-to-buy-and-sell-stock-iv/, Hard], [Maximum Sum of 3 Non-Overlapping Subarrays, /problems/maximum-sum-of-3-non-overlapping-subarrays/, Hard]",https://leetcode.com/articles/best-time-to-buy-and-sell-stock-iii,https://leetcode.com/problems/best-time-to-buy-and-sell-stock-iii,"You are given an array prices where prices[i] is the price of a given stock on the ith day. Find the maximum profit you can achieve. You may complete at most two transactions. Note: You may not engage in multiple transactions simultaneously (i.e., you must sell the stock before you buy again). ",./PythonSolutions/best-time-to-buy-and-sell-stock-iii.py,True
124,Binary Tree Maximum Path Sum,Hard,"[Path Sum, /problems/path-sum/, Easy], [Sum Root to Leaf Numbers, /problems/sum-root-to-leaf-numbers/, Medium], [Path Sum IV, /problems/path-sum-iv/, Medium], [Longest Univalue Path, /problems/longest-univalue-path/, Medium], [Time Needed to Inform All Employees, /problems/time-needed-to-inform-all-employees/, Medium]",https://leetcode.com/articles/binary-tree-maximum-path-sum,https://leetcode.com/problems/binary-tree-maximum-path-sum,"A path in a binary tree is a sequence of nodes where each pair of adjacent nodes in the sequence has an edge connecting them. A node can only appear in the sequence at most once. Note that the path does not need to pass through the root. The path sum of a path is the sum of the node's values in the path. Given the root of a binary tree, return the maximum path sum of any non-empty path. ",./PythonSolutions/binary-tree-maximum-path-sum.py,True
125,Valid Palindrome,Easy,"[Palindrome Linked List, /problems/palindrome-linked-list/, Easy], [Valid Palindrome II, /problems/valid-palindrome-ii/, Easy]",https://leetcode.com/articles/valid-palindrome,https://leetcode.com/problems/valid-palindrome,"A phrase is a palindrome if, after converting all uppercase letters into lowercase letters and removing all non-alphanumeric characters, it reads the same forward and backward. Alphanumeric characters include letters and numbers. Given a string s, return true if it is a palindrome, or false otherwise. ",./PythonSolutions/valid-palindrome.py,True
127,Word Ladder,Hard,"[Word Ladder II, /problems/word-ladder-ii/, Hard], [Minimum Genetic Mutation, /problems/minimum-genetic-mutation/, Medium]",https://leetcode.com/articles/word-ladder,https://leetcode.com/problems/word-ladder,"A transformation sequence from word beginWord to word endWord using a dictionary wordList is a sequence of words beginWord -> s1 -> s2 -> ... -> sk such that: Given two words, beginWord and endWord, and a dictionary wordList, return the number of words in the shortest transformation sequence from beginWord to endWord, or 0 if no such sequence exists. ",./PythonSolutions/word-ladder.py,True
128,Longest Consecutive Sequence,Hard,"[Binary Tree Longest Consecutive Sequence, /problems/binary-tree-longest-consecutive-sequence/, Medium]",https://leetcode.com/articles/longest-consecutive-sequence,https://leetcode.com/problems/longest-consecutive-sequence,"Given an unsorted array of integers nums, return the length of the longest consecutive elements sequence. You must write an algorithm that runs in O(n) time. ",./PythonSolutions/longest-consecutive-sequence.py,True
129,Sum Root to Leaf Numbers,Medium,"[Path Sum, /problems/path-sum/, Easy], [Binary Tree Maximum Path Sum, /problems/binary-tree-maximum-path-sum/, Hard], [Smallest String Starting From Leaf, /problems/smallest-string-starting-from-leaf/, Medium]",https://leetcode.com/articles/sum-root-to-leaf-numbers,https://leetcode.com/problems/sum-root-to-leaf-numbers,You are given the root of a binary tree containing digits from 0 to 9 only. Each root-to-leaf path in the tree represents a number. Return the total sum of all root-to-leaf numbers. Test cases are generated so that the answer will fit in a 32-bit integer. A leaf node is a node with no children. ,./PythonSolutions/sum-root-to-leaf-numbers.py,True
130,Surrounded Regions,Medium,"[Number of Islands, /problems/number-of-islands/, Medium], [Walls and Gates, /problems/walls-and-gates/, Medium]",https://leetcode.com/articles/surrounded-regions,https://leetcode.com/problems/surrounded-regions,"Given an m x n matrix board containing 'X' and 'O', capture all regions that are 4-directionally surrounded by 'X'. A region is captured by flipping all 'O's into 'X's in that surrounded region. ",./PythonSolutions/surrounded-regions.py,True
131,Palindrome Partitioning,Medium,"[Palindrome Partitioning II, /problems/palindrome-partitioning-ii/, Hard], [Palindrome Partitioning IV, /problems/palindrome-partitioning-iv/, Hard]",https://leetcode.com/articles/palindrome-partitioning,https://leetcode.com/problems/palindrome-partitioning,"Given a string s, partition s such that every substring of the partition is a palindrome. Return all possible palindrome partitioning of s. A palindrome string is a string that reads the same backward as forward. ",./PythonSolutions/palindrome-partitioning.py,True
133,Clone Graph,Medium,"[Copy List with Random Pointer, /problems/copy-list-with-random-pointer/, Medium], [Clone Binary Tree With Random Pointer, /problems/clone-binary-tree-with-random-pointer/, Medium], [Clone N-ary Tree, /problems/clone-n-ary-tree/, Medium]",https://leetcode.com/articles/clone-graph,https://leetcode.com/problems/clone-graph,"Given a reference of a node in a connected undirected graph. Return a deep copy (clone) of the graph. Each node in the graph contains a value (int) and a list (List[Node]) of its neighbors.  Test case format: For simplicity, each node's value is the same as the node's index (1-indexed). For example, the first node with val == 1, the second node with val == 2, and so on. The graph is represented in the test case using an adjacency list. An adjacency list is a collection of unordered lists used to represent a finite graph. Each list describes the set of neighbors of a node in the graph. The given node will always be the first node with val = 1. You must return the copy of the given node as a reference to the cloned graph. ",./PythonSolutions/clone-graph.py,True
136,Single Number,Easy,"[Single Number II, /problems/single-number-ii/, Medium], [Single Number III, /problems/single-number-iii/, Medium], [Missing Number, /problems/missing-number/, Easy], [Find the Duplicate Number, /problems/find-the-duplicate-number/, Medium], [Find the Difference, /problems/find-the-difference/, Easy]",https://leetcode.com/articles/single-number,https://leetcode.com/problems/single-number,"Given a non-empty array of integers nums, every element appears twice except for one. Find that single one. You must implement a solution with a linear runtime complexity and use only constant extra space. ",./PythonSolutions/single-number.py,True
137,Single Number II,Medium,"[Single Number, /problems/single-number/, Easy], [Single Number III, /problems/single-number-iii/, Medium]",https://leetcode.com/articles/single-number-ii,https://leetcode.com/problems/single-number-ii,"Given an integer array nums where every element appears three times except for one, which appears exactly once. Find the single element and return it. You must implement a solution with a linear runtime complexity and use only constant extra space. ",./PythonSolutions/single-number-ii.py,True
138,Copy List with Random Pointer,Medium,"[Clone Graph, /problems/clone-graph/, Medium], [Clone Binary Tree With Random Pointer, /problems/clone-binary-tree-with-random-pointer/, Medium], [Clone N-ary Tree, /problems/clone-n-ary-tree/, Medium]",https://leetcode.com/articles/copy-list-with-random-pointer,https://leetcode.com/problems/copy-list-with-random-pointer,"A linked list of length n is given such that each node contains an additional random pointer, which could point to any node in the list, or null. Construct a deep copy of the list. The deep copy should consist of exactly n brand new nodes, where each new node has its value set to the value of its corresponding original node. Both the next and random pointer of the new nodes should point to new nodes in the copied list such that the pointers in the original list and copied list represent the same list state. None of the pointers in the new list should point to nodes in the original list. For example, if there are two nodes X and Y in the original list, where X.random --> Y, then for the corresponding two nodes x and y in the copied list, x.random --> y. Return the head of the copied linked list. The linked list is represented in the input/output as a list of n nodes. Each node is represented as a pair of [val, random_index] where: Your code will only be given the head of the original linked list. ",./PythonSolutions/copy-list-with-random-pointer.py,True
139,Word Break,Medium,"[Word Break II, /problems/word-break-ii/, Hard]",https://leetcode.com/articles/word-break,https://leetcode.com/problems/word-break,"Given a string s and a dictionary of strings wordDict, return true if s can be segmented into a space-separated sequence of one or more dictionary words. Note that the same word in the dictionary may be reused multiple times in the segmentation. ",./PythonSolutions/word-break.py,True
140,Word Break II,Hard,"[Word Break, /problems/word-break/, Medium], [Concatenated Words, /problems/concatenated-words/, Hard]",https://leetcode.com/articles/word-break-ii,https://leetcode.com/problems/word-break-ii,"Given a string s and a dictionary of strings wordDict, add spaces in s to construct a sentence where each word is a valid dictionary word. Return all such possible sentences in any order. Note that the same word in the dictionary may be reused multiple times in the segmentation. ",./PythonSolutions/word-break-ii.py,True
141,Linked List Cycle,Easy,"[Linked List Cycle II, /problems/linked-list-cycle-ii/, Medium], [Happy Number, /problems/happy-number/, Easy]",https://leetcode.com/articles/linked-list-cycle,https://leetcode.com/problems/linked-list-cycle,"Given head, the head of a linked list, determine if the linked list has a cycle in it. There is a cycle in a linked list if there is some node in the list that can be reached again by continuously following the next pointer. Internally, pos is used to denote the index of the node that tail's next pointer is connected to. Note that pos is not passed as a parameter. Return true if there is a cycle in the linked list. Otherwise, return false. ",./PythonSolutions/linked-list-cycle.py,True
142,Linked List Cycle II,Medium,"[Linked List Cycle, /problems/linked-list-cycle/, Easy], [Find the Duplicate Number, /problems/find-the-duplicate-number/, Medium]",https://leetcode.com/articles/linked-list-cycle-ii,https://leetcode.com/problems/linked-list-cycle-ii,"Given the head of a linked list, return the node where the cycle begins. If there is no cycle, return null. There is a cycle in a linked list if there is some node in the list that can be reached again by continuously following the next pointer. Internally, pos is used to denote the index of the node that tail's next pointer is connected to (0-indexed). It is -1 if there is no cycle. Note that pos is not passed as a parameter. Do not modify the linked list. ",./PythonSolutions/linked-list-cycle-ii.py,True
144,Binary Tree Preorder Traversal,Medium,"[Binary Tree Inorder Traversal, /problems/binary-tree-inorder-traversal/, Medium], [Verify Preorder Sequence in Binary Search Tree, /problems/verify-preorder-sequence-in-binary-search-tree/, Medium], [N-ary Tree Preorder Traversal, /problems/n-ary-tree-preorder-traversal/, Easy]",https://leetcode.com/articles/binary-tree-preorder-traversal,https://leetcode.com/problems/binary-tree-preorder-traversal,"Given the root of a binary tree, return the preorder traversal of its nodes' values. ",./PythonSolutions/binary-tree-preorder-traversal.py,True
145,Binary Tree Postorder Traversal,Medium,"[Binary Tree Inorder Traversal, /problems/binary-tree-inorder-traversal/, Medium], [N-ary Tree Postorder Traversal, /problems/n-ary-tree-postorder-traversal/, Easy]",https://leetcode.com/articles/binary-tree-postorder-traversal,https://leetcode.com/problems/binary-tree-postorder-traversal,"Given the root of a binary tree, return the postorder traversal of its nodes' values. ",./PythonSolutions/binary-tree-postorder-traversal.py,True
146,LRU Cache,Medium,"[LFU Cache, /problems/lfu-cache/, Hard], [Design In-Memory File System, /problems/design-in-memory-file-system/, Hard], [Design Compressed String Iterator, /problems/design-compressed-string-iterator/, Easy], [Design Most Recently Used Queue, /problems/design-most-recently-used-queue/, Medium]",https://leetcode.com/articles/lru-cache,https://leetcode.com/problems/lru-cache,Design a data structure that follows the constraints of a Least Recently Used (LRU) cache. Implement the LRUCache class: The functions get and put must each run in O(1) average time complexity. ,./PythonSolutions/lru-cache.py,True
147,Insertion Sort List,Medium,"[Sort List, /problems/sort-list/, Medium], [Insert into a Sorted Circular Linked List, /problems/insert-into-a-sorted-circular-linked-list/, Medium]",https://leetcode.com/articles/insertion-sort-list,https://leetcode.com/problems/insertion-sort-list,"Given the head of a singly linked list, sort the list using insertion sort, and return the sorted list's head. The steps of the insertion sort algorithm: The following is a graphical example of the insertion sort algorithm. The partially sorted list (black) initially contains only the first element in the list. One element (red) is removed from the input data and inserted in-place into the sorted list with each iteration. ",./PythonSolutions/insertion-sort-list.py,True
